{
  "schema_version": 1,
  "run_id": "20260101T101112Z-a1b2c3d4",
  "application": "xfce-guacamole",
  "flavor": "disposable",
  "deployment": "dev-box",
  "application_commit": null,
  "development_override": true,
  "phases": ["install", "verify"],
  "status": "succeeded",
  "started_at": "2026-01-01T10:11:12Z",
  "ended_at": "2026-01-01T10:21:12Z",
  "writer": {
    "host": "cloudai",
    "boot_id": "3f2a1b0c-4d5e-6f70-8192-a3b4c5d6e7f8",
    "pid": 48213,
    "process_start_ticks": 91726345
  },
  "interrupted": null
}
